{
  "schema_version": "0.1",
  "run_id": "run-65f08ff607c9d916afe60b94bb392be048fa5070d3e54cf01c58abad1c9b7d0e",
  "project_id": "o0-v2-m2-project",
  "phase": "O0",
  "gate": "NONE",
  "machine_state": "WAITING_PRODUCT_AUTHORITY",
  "next_actor": "PRODUCT_AUTHORITY",
  "blocked_reason": null,
  "builder_branch": "main",
  "builder_executor_id": "antigravity-cli",
  "auditor_executor_id": "codex-cli",
  "product_authority_id": "configured-product-authority",
  "builder_head_sha": "8cf01e56bbd82e86d021d2d671e4474d1c1880e2",
  "audit_target_sha": "8cf01e56bbd82e86d021d2d671e4474d1c1880e2",
  "last_audited_sha": "8cf01e56bbd82e86d021d2d671e4474d1c1880e2",
  "audit_round": 1,
  "max_audit_rounds": 3,
  "last_builder_report": "A:\\ideias_standard\\.tmp_o0_m2_run\\reports\\builder-report.json",
  "last_audit_report": "A:\\ideias_standard\\.tmp_o0_m2_run\\reports\\audit-report.json",
  "last_audit_report_sha256": "0a2bbf9efce9116fe91aa7ba66e59b495e4e0713e7807dfa44b5cf88c013b20a",
  "last_audit_result": "PASS",
  "human_gate_required": true,
  "approval": null,
  "updated_at": "2026-09-16T20:28:53.944594+00:00",
  "message": "Independent audit passed for the frozen SHA. Automation must stop until explicit Product Authority gate registration."
}
