{
  "schema_version": "0.1",
  "run_id": "run-8dd4e0bc91302e6836ab90267f38b71e258acc9316195bfd2f677785c5e06109",
  "project_id": "interruption-auditor-cancel",
  "phase": "O0",
  "gate": "NONE",
  "machine_state": "WAITING_PRODUCT_AUTHORITY",
  "next_actor": "PRODUCT_AUTHORITY",
  "blocked_reason": null,
  "builder_branch": "main",
  "builder_executor_id": null,
  "auditor_executor_id": "codex-cli",
  "product_authority_id": "configured-product-authority",
  "builder_head_sha": "eb11e1ddcf07b415201cdd49ee81d3b416bd2c6b",
  "audit_target_sha": "eb11e1ddcf07b415201cdd49ee81d3b416bd2c6b",
  "last_audited_sha": "eb11e1ddcf07b415201cdd49ee81d3b416bd2c6b",
  "audit_round": 1,
  "max_audit_rounds": 3,
  "last_builder_report": null,
  "last_audit_report": "C:\\Users\\fael\\AppData\\Local\\Temp\\o0-v2-m5-work\\m5-resume-proof\\auditor-cancel\\interrupted\\reports\\audit-report.json",
  "last_audit_report_sha256": "8ccff3ac1bee785d9ac90036b1a1186b972a51fd93768d75b739c4fb8b047a2d",
  "last_audit_result": "PASS",
  "human_gate_required": true,
  "approval": null,
  "updated_at": "2026-09-17T00:58:48.551786+00:00",
  "message": "Independent audit passed for the frozen SHA. Automation must stop until explicit Product Authority gate registration."
}
