{
  "schema_version": "0.1",
  "run_id": "run-8dd4e0bc91302e6836ab90267f38b71e258acc9316195bfd2f677785c5e06109",
  "project_id": "interruption-auditor-cancel",
  "phase": "O0",
  "gate": "NONE",
  "machine_state": "READY_FOR_AUDIT",
  "next_actor": "AUDITOR",
  "blocked_reason": null,
  "builder_branch": "main",
  "builder_executor_id": null,
  "auditor_executor_id": null,
  "product_authority_id": "configured-product-authority",
  "builder_head_sha": "c3897fde5fe6a6bca5d9a3b811a0d0f4ab79203f",
  "audit_target_sha": "c3897fde5fe6a6bca5d9a3b811a0d0f4ab79203f",
  "last_audited_sha": null,
  "audit_round": 0,
  "max_audit_rounds": 3,
  "last_builder_report": null,
  "last_audit_report": null,
  "last_audit_report_sha256": null,
  "last_audit_result": null,
  "human_gate_required": true,
  "approval": null,
  "updated_at": "2026-09-16T20:47:06.632248+00:00",
  "message": "Ready for Builder."
}