{
  "schema_version": "0.1",
  "run_id": "run-97973bd215003ae5c5b33c1c4301081cc561c2e0b5576185ca63b2ace612dc00",
  "project_id": "ideias-standard",
  "phase": "O0",
  "gate": "NONE",
  "machine_state": "WAITING_PRODUCT_AUTHORITY",
  "next_actor": "PRODUCT_AUTHORITY",
  "blocked_reason": null,
  "builder_branch": "main",
  "builder_executor_id": "antigravity-cli",
  "auditor_executor_id": "codex-cli",
  "product_authority_id": "owner",
  "builder_head_sha": "eb11e1ddcf07b415201cdd49ee81d3b416bd2c6b",
  "audit_target_sha": "eb11e1ddcf07b415201cdd49ee81d3b416bd2c6b",
  "last_audited_sha": "eb11e1ddcf07b415201cdd49ee81d3b416bd2c6b",
  "audit_round": 1,
  "max_audit_rounds": 3,
  "last_builder_report": "C:\\Users\\fael\\AppData\\Local\\Temp\\o0-v2-m5-work\\reports\\builder-report.json",
  "last_audit_report": "C:\\Users\\fael\\AppData\\Local\\Temp\\o0-v2-m5-work\\reports\\audit-report.json",
  "last_audit_report_sha256": "a072c781fc5af773059e25cbfa7bb3aec290df8dd9b089d318ee314333e963a3",
  "last_audit_result": "PASS",
  "human_gate_required": true,
  "approval": null,
  "updated_at": "2026-09-17T00:47:40.030333+00:00",
  "message": "Independent audit passed for the frozen SHA. Automation must stop until explicit Product Authority gate registration."
}
