{
  "schema_version": "0.1",
  "run_id": "run-4c21fd3e865c4595dc70d9979aa4b28aacdee1d0e723dc5a20674daf59941d95",
  "project_id": "interruption-builder-timeout",
  "phase": "O0",
  "gate": "NONE",
  "machine_state": "READY_FOR_BUILD",
  "next_actor": "BUILDER",
  "blocked_reason": null,
  "builder_branch": "main",
  "builder_executor_id": null,
  "auditor_executor_id": null,
  "product_authority_id": "configured-product-authority",
  "builder_head_sha": null,
  "audit_target_sha": null,
  "last_audited_sha": null,
  "audit_round": 0,
  "max_audit_rounds": 3,
  "last_builder_report": null,
  "last_audit_report": null,
  "last_audit_report_sha256": null,
  "last_audit_result": null,
  "human_gate_required": true,
  "approval": null,
  "updated_at": "2026-09-16T20:46:48.523569+00:00",
  "message": "Ready for Builder."
}
