{
  "schema_version": "0.1",
  "run_id": "run-65f08ff607c9d916afe60b94bb392be048fa5070d3e54cf01c58abad1c9b7d0e",
  "project_id": "o0-v2-m2-project",
  "phase": "O0",
  "gate": "NONE",
  "machine_state": "WAITING_PRODUCT_AUTHORITY",
  "next_actor": "PRODUCT_AUTHORITY",
  "blocked_reason": null,
  "builder_branch": "main",
  "builder_executor_id": "antigravity-cli",
  "auditor_executor_id": "codex-cli",
  "product_authority_id": "configured-product-authority",
  "builder_head_sha": "c3897fde5fe6a6bca5d9a3b811a0d0f4ab79203f",
  "audit_target_sha": "c3897fde5fe6a6bca5d9a3b811a0d0f4ab79203f",
  "last_audited_sha": "c3897fde5fe6a6bca5d9a3b811a0d0f4ab79203f",
  "audit_round": 1,
  "max_audit_rounds": 3,
  "last_builder_report": "C:\\Users\\fael\\Documents\\Codex\\2026-09-14\\ideias-o0-v2-m2-process-run-final\\reports\\builder-report.json",
  "last_audit_report": "C:\\Users\\fael\\Documents\\Codex\\2026-09-14\\ideias-o0-v2-m2-process-run-final\\reports\\audit-report.json",
  "last_audit_report_sha256": "acbe35fce2ffb7407974cfcbc2e2d6c007dc5bf39fcb3a07bbf64f47201d16d0",
  "last_audit_result": "PASS",
  "human_gate_required": true,
  "approval": null,
  "updated_at": "2026-09-16T20:46:48.161450+00:00",
  "message": "Independent audit passed for the frozen SHA. Automation must stop until explicit Product Authority gate registration."
}
