{
  "schema_version": "0.1",
  "run_id": "run-4c21fd3e865c4595dc70d9979aa4b28aacdee1d0e723dc5a20674daf59941d95",
  "project_id": "interruption-builder-timeout",
  "phase": "O0",
  "gate": "NONE",
  "machine_state": "READY_FOR_AUDIT",
  "next_actor": "AUDITOR",
  "blocked_reason": null,
  "builder_branch": "main",
  "builder_executor_id": "antigravity-cli",
  "auditor_executor_id": null,
  "product_authority_id": "configured-product-authority",
  "builder_head_sha": "e4dffa9df3fe5429aefd47b5457aa2a69029532b",
  "audit_target_sha": "e4dffa9df3fe5429aefd47b5457aa2a69029532b",
  "last_audited_sha": null,
  "audit_round": 0,
  "max_audit_rounds": 3,
  "last_builder_report": "C:\\Users\\fael\\AppData\\Local\\Temp\\o0-v2-m5-work\\m5-resume-proof\\builder-timeout\\interrupted\\reports\\builder-report.json",
  "last_audit_report": null,
  "last_audit_report_sha256": null,
  "last_audit_result": null,
  "human_gate_required": true,
  "approval": null,
  "updated_at": "2026-09-17T00:57:59.821453+00:00",
  "message": "Audit target frozen at e4dffa9df3fe5429aefd47b5457aa2a69029532b."
}
