{
  "schema_version": "0.1",
  "run_id": "run-a204cbe5ab562574f197b71d5ecce1337f7749dabb1d4d016fe0a6935c31e8a5",
  "project_id": "ideias-standard",
  "phase": "O0",
  "gate": "NONE",
  "machine_state": "WAITING_PRODUCT_AUTHORITY",
  "next_actor": "PRODUCT_AUTHORITY",
  "blocked_reason": null,
  "builder_branch": "main",
  "builder_executor_id": "queue-builder",
  "auditor_executor_id": "queue-auditor",
  "product_authority_id": "owner",
  "builder_head_sha": "4beaaaaf0bf0800e829cc5dbd00088943d1575ed",
  "audit_target_sha": "4beaaaaf0bf0800e829cc5dbd00088943d1575ed",
  "last_audited_sha": "4beaaaaf0bf0800e829cc5dbd00088943d1575ed",
  "audit_round": 1,
  "max_audit_rounds": 3,
  "last_builder_report": "C:\\Users\\fael\\AppData\\Local\\Temp\\o0_v2_m4_work\\reports\\builder-report.json",
  "last_audit_report": "C:\\Users\\fael\\AppData\\Local\\Temp\\o0_v2_m4_work\\reports\\audit-report.json",
  "last_audit_report_sha256": "391fc390dc5c859afe5c9c8355e6b76c848839a957c123d336c426628d9d70ff",
  "last_audit_result": "PASS",
  "human_gate_required": true,
  "approval": null,
  "updated_at": "2026-09-16T23:30:16.967174+00:00",
  "message": "Independent audit passed for the frozen SHA. Automation must stop until explicit Product Authority gate registration."
}
