{
  "schema_version": "0.1",
  "run_id": "run-c0ebfc6bad6dab143c206953f31ad8c5c036f785ccdce7ccc02f571fab0aa040",
  "project_id": "o0-v2-m3-correction-cycle",
  "phase": "O0",
  "gate": "NONE",
  "machine_state": "WAITING_PRODUCT_AUTHORITY",
  "next_actor": "PRODUCT_AUTHORITY",
  "blocked_reason": null,
  "builder_branch": "main",
  "builder_executor_id": "antigravity-cli",
  "auditor_executor_id": "codex-cli",
  "product_authority_id": "configured-product-authority",
  "builder_head_sha": "d360c36033f3afc8b3210c861d9013223fefdf0a",
  "audit_target_sha": "d360c36033f3afc8b3210c861d9013223fefdf0a",
  "last_audited_sha": "d360c36033f3afc8b3210c861d9013223fefdf0a",
  "audit_round": 2,
  "max_audit_rounds": 3,
  "last_builder_report": "C:\\Users\\fael\\AppData\\Local\\Temp\\o0_v2_m3_work\\reports\\builder-report.json",
  "last_audit_report": "C:\\Users\\fael\\AppData\\Local\\Temp\\o0_v2_m3_work\\reports\\audit-report.json",
  "last_audit_report_sha256": "8d693993040a4b0de5801dfb14447832265822a77665c127cab81e11e0cf1f4c",
  "last_audit_result": "PASS",
  "human_gate_required": true,
  "approval": null,
  "updated_at": "2026-09-16T21:43:18.542117+00:00",
  "message": "Independent audit passed for the frozen SHA. Automation must stop until explicit Product Authority gate registration."
}
