{
  "schema_version": "0.1",
  "run_id": "run-0000000000000000000000000000000000000000000000000000000000000000",
  "project_id": "sample",
  "phase": "F01",
  "gate": "G01",
  "machine_state": "READY_FOR_BUILD",
  "next_actor": "BUILDER",
  "blocked_reason": null,
  "builder_branch": "work/sample-f01",
  "builder_executor_id": null,
  "auditor_executor_id": null,
  "product_authority_id": "product-authority",
  "builder_head_sha": null,
  "audit_target_sha": null,
  "last_audited_sha": null,
  "audit_round": 0,
  "max_audit_rounds": 3,
  "last_builder_report": null,
  "last_audit_report": null,
  "last_audit_result": null,
  "human_gate_required": true,
  "approval": null,
  "updated_at": "2026-09-14T12:00:00+00:00",
  "message": "Ready for Builder."
}
